relevant,restraining,CATEGORICAL_SENTIMENT_DISCLOSURE,k_relevant,CATEGORICAL_SENTIMENT_JOBS,house,sex,CATEGORY_FOREIGNPOLICY,days_since_strike,last_name,CATEGORICAL_SENTIMENT_REFERENCE,CATEGORICAL_SENTIMENT_FOREIGNUSE,seniority,CATEGORY_PTSD,dim_2,id,dim_1,first_name,CATEGORY_DISCLOSURE,k_sentiment,icpsr,title,CATEGORICAL_SENTIMENT_FOREIGNPOLICY,general_sentiment,CATEGORICAL_SENTIMENT_PTSD,state,106_seniority,CATEGORICAL_SENTIMENT_INTERNATIONAL-LEGALITY,statement,CATEGORICAL_SENTIMENT_FINANCE,party,CATEGORY_REFERENCE,filibuster,CATEGORY_INTERNATIONAL-LEGALITY,CATEGORICAL_SENTIMENT_DOMESTIC-LEGALITY,CATEGORY_HUMANITARIAN,congress,days_until_term_ends,loyalty,CATEGORY_JOBS,CATEGORY_DOMESTIC-LEGALITY,date,state_code,dronebase,categories,CATEGORY_FOREIGNUSE,CATEGORY_TECHNOLOGY,CATEGORY_FINANCE,periphery,CATEGORICAL_SENTIMENT_TECHNOLOGY,CATEGORICAL_SENTIMENT_HUMANITARIAN,k_restraining,strike_recently,votes,unsigned_periphery
0,0,,1,,0,1,0,8,CARPER,,,13,0,-0.222,c3fc9cdc988c030436330158c802402d,-0.174,Thomas,0,1,15015,OUR SOUTHERN BORDER AND IMMIGRATION REFORM,,,,DELAWAR,8,,"I am convinced there is a great potential there. I am determined. I am sure working with Democrats and Republicans and our committee in the Senate and hopefully the House and certainly with the administration. We need to make sure we are getting full value for everything we are putting into the drone technology, in the deployment of drones.",,1,0,0,0,,0,114,1423,1,0,0,2/10/15,11,0,{},0,0,0,-1.1657013919630359,,,0,0,409,1.1657013919630359
0,0,,1,,,1,0,26,Barrasso,,,,0,,d52f988138c7519f5f1fef9012ae9822,,John,0,-1,,UNANIMOUS CONSENT REQUEST--EXECUTIVE CALENDAR,,,,WYOMING,,,"For that reason, I once again request you answer the following question: Do you believe that the President has the power to authorize lethal force, such as a drone strike, against a U.S. citizen on U.S. soil, and without trial?",,0,0,0,0,,0,113,2129,0,0,0,3/6/13,,0,{},0,0,0,,,,1,0,,
0,0,,1,,0,0,0,27,FEINSTEIN,,,11,0,-0.188,0952a0044a4ef9cac789c43221a64bb8,-0.263,Dianne,0,1,49300,EXECUTIVE SESSION,,,,CALIFOR,8,,"I also wish to address the drone issue once more, mainly to discuss the hypothetical examples offered yesterday by the Senator from Kentucky. On Fox News this week, he mentioned--and I began with this ``what we are talking about is eating dinner in your house, you are eating in a cafe or walking down the road, and a drone strike can occur. It is not about people involved in combat, it is about people who they think might be.''",,1,0,0,0,,0,113,2128,1,0,0,3/7/13,71,2,{},0,0,0,-0.52599278690708318,,,0,0,523,0.52599278690708318
0,0,,1,,0,1,0,26,PAUL,,,2,0,-0.5,19821850e189ba75a7bb207beda0715d,0.866,Rand,0,-1,41104,BRENNAN NOMINATION,,,,KENTUCK,2,,"Mr. President, I wish to thank the ranking member of the Intelligence Committee and also say this could come to a close anytime if the President will sort of say what Attorney General Holder was trying to say this morning, and put it into actual words, that he thinks he has the military authority to reject imminent attack. I think we all agree to that. But if he says he is not going to use drones on people who are not engaged in combat in America, I think we could be done with this debate--I think one phone call from the President to clarify what his position is or from the Attorney General to actually write out what his position is.",,0,0,1,0,,0,113,1399,0,0,0,3/6/13,51,1,{},0,0,0,2.6571794444104921,,,1,0,537,2.6571794444104921
0,0,,1,,0,1,0,0,NELSON,,,14,0,0.314,231ad548ee916eedfd8746a6ae58cfa2,-0.189,Bill,0,1,14651,DRONES,,,,FLORIDA,8,,"Mr. President, have you ever flown a drone? It used to be that you had to fly helicopters or it used to be that you would fly what we call unmanned aerial vehicles, the ones that have been so helpful to us in the war against terror. That would usually be an Air Force pilot. But now people can go to Best Buy or to Walgreens or to the hobby shop and buy a drone this big. If it is an older model, it would cost $100. If it is a newer model, it would cost $500. People can have a lot of fun. As a matter of fact, I can't wait until they finish development of the drones they are testing right now that I can sit on, and then I can go from point A to point B and avoid the red lights and the traffic jams and so forth.",,1,0,0,0,,0,114,1080,1,0,0,1/19/16,43,1,{},0,0,0,-1.0578853349311337,,,0,1,394,1.0578853349311337
0,0,,1,,0,1,0,76,ISAKSON,,,4,0,0.01,66680773bc76f116d1e6cfc12df677e3,0.403,John,0,1,29909,SECURING AMERICA'S BORDERS ACT,,,,GEORGIA,4,,"The distinguished Senator from New Hampshire, who is on the floor, has been an absolute leader to the appropriations and the budget process in focusing like a laser beam on seeing to it that we authorize and ultimately appropriate the funds to do exactly that in terms of manpower. I will join him in that as well as those who put the funds up for the unmanned aerial vehicle surveillance and the ground sensors for tunneling and other technology we have.",,0,0,0,0,,0,109,1740,1,0,0,3/30/06,44,2,{},0,0,0,-0.22918660056553766,,,0,0,513,0.22918660056553766
1,0,,0,,0,1,1,6,LEAHY,,,18,0,-0.15,6540e65a0b2d9c5d2bca2306ab1ca0af,-0.375,Patrick,0,0,14307,NATIONAL DEFENSE AUTHORIZATION ACT FOR FISCAL YEAR 2010,1,1,,VERMONT,6,,"Given developments in unmanned aerial vehicles, it could also be the country's last major tactical aircraft program. The F-35 will provide a tremendous general purpose capability to replace the Air Force's aging F-16s, the Marine Corps' AV-8Bs, and older versions of the F/A-18. We have to get development of this aircraft right. The kind of delays and cost overruns that have plagued development of so many other defense programs recently would be absolutely unacceptable in this far-reaching program.",1,1,0,0,0,,0,111,529,1,0,0,7/23/09,6,0,"{u'FOREIGNPOLICY': 1, u'FINANCE': 1}",0,0,1,0.27903377226445264,,,,1,606,0.27903377226445264
0,0,,1,,1,1,0,179,CARTER,,,2,0,0.693,6da07f3079aaa268ed4206d7eeee23c7,0.466,John,0,1,20356,THE TRUTH ABOUT THE WAR IN IRAQ,,,,TEXAS,2,,"I remember when I was in Afghanistan, the story I love to tell about a 20-year-old sitting looking at a screen of a film of a drone that was broadcasting pictures from the desert. And while we were there, he went to his commander and said, Sir, there is a bunch of camels crossing out there in a part where there should not be any camels. And I thought, how does this kid know there are not supposed to be any camels in this part of the country? He said, I think there are people underneath those camels.",,0,0,0,0,,0,109,426,1,0,0,11/3/05,49,2,{},0,0,0,0.16355867121305823,,,0,0,864,0.16355867121305823
1,0,,,,,,0,,,,-1,,0,,fa5906a059cc0a7321a5523cfe747eb8,,,0,,,House of Representatives,,,,,,,"We cannot allow nations, as a matter of their public policy, to develop chemical, biological, and nuclear weapons that can be delivered in lethal amounts all around the world. Whether it be delivery through terrorist organizations such as al Qaeda or hard-to-detect drones with sprayer nozzles, there are now the means to deliver these weapons of mass destruction into the very hearts of our cities and towns. The attack of September 11 was only the most vivid and terrible demonstration of the power of hate to deliver death and destruction of incredible dimensions by stealth means.",,,0,0,0,,0,107,,0,0,0,10/9/02,,,{u'FOREIGNUSE': -1},1,0,0,,,,,1,,
1,0,,0,,1,1,0,578,KIRK,,-1,2,0,-0.647,d2bdc4a8915b61ccb72815619d974cf5,0.274,Mark,0,,20115,THE CASE FOR A SPECIAL RELATIONSHIP WITH CHINA,,,,ILLINOI,2,,"Their efforts also include producing laser weapons, such as the man-portable ZM-87, advertised for blinding human vision and electro-optical sensors, radio-frequency weapons and possibly a ground-based anti-satellite weapon. They have also invested considerably in developing short- and medium-range unmanned aerial vehicles, including an unmanned combat aerial vehicle.",,0,0,0,0,,0,108,214,1,0,0,6/3/04,21,0,{u'FOREIGNUSE': -1},1,0,0,-1.0333792999217102,,,,0,817,1.0333792999217102
0,0,,1,,1,1,0,,LEWIS,,,12,0,-0.101,7470201db5165e51d37c989b0a39938b,0.348,Jerry,0,1,14644,A TRIBUTE TO LETITIA HOADLEY WHITE,,,,CALIFOR,2,,"She has also shared with me a desire to encourage innovation and small business. Years ago, I asked Letitia to help me make sure the Pentagon provided increased funding for rapid development of a radical new technology--unmanned aerial vehicles. Through her work, we managed to move up testing and evaluation of the Predator UAV program by two years. Now, of course, it is one of the most highly touted new weapons in our war against terrorism.",,0,0,0,0,,0,107,416,1,0,0,11/13/01,71,2,{},0,0,0,-0.57205945688018522,,,0,1,637,0.57205945688018522
1,0,,0,,1,1,0,465,INSLEE,,-1,4,0,-0.194,5adec567667a499274c9f426aaf3ed94,-0.33,Jay,0,,29937,IRAQ WATCH,,,,WASHING,3,,"The gentlemen will recall when the President and others made repeated references to the unmanned aerial vehicles that they told us was a threat to the continental United States, that Iraq could fly over American cities and spray biological material over the United States and none of us can always ever eliminate any threat. Today somebody may be planning to do that today as we speak. I do not want to be Pollyanna-ish about this, but the President told us that our intelligence services were telling us that was going on.",,1,0,0,0,,0,108,327,0,0,0,2/11/04,73,1,{u'FOREIGNUSE': -1},1,0,0,-0.044414398831253615,,,,0,841,0.044414398831253615
0,0,,1,,0,1,0,27,MCCONNELL,,,15,0,0.027,e05e1ed584570f95c299349e8341ab65,0.404,Mitch,0,-1,14921,BRENNAN NOMINATION,,,,KENTUCK,8,,"The U.S. military no more has the right to kill a U.S. citizen on U.S. soil who is not a combatant with an armed unmanned aerial vehicle than it does with an M-16. The technology is beside the point. It simply doesn't have that right, and the administration should simply answer the question. There is no reason we cannot get this question answered today. And we should get the question answered today. Frankly, it should have been answered a long time ago.",,0,0,0,0,,0,113,667,0,0,0,3/7/13,51,1,{},0,0,0,-0.22295254863254407,,,1,0,550,0.22295254863254407
0,0,,1,,,1,0,17,Tipton,,,,0,,44243047a6d5c8d764adaeae8764a412,,Scott,0,1,,TERRY WETHERILL,,,,COLORADO,,,"As Mineral County Emergency Manager, Terry has spearheaded the use of technology to aid in difficult search and rescue missions in the San Luis Valley in situations where all-terrain vehicles and snowmobiles can't access those in need of emergency services. Avalanches and steep cliffs create treacherous conditions in parts of the San Luis Valley, and the drone helps prevent rescuers from having to put themselves in life-threatening situations, Thanks to the work of Terry's office, Archuleta, Hinsdale, Mineral, and Rio Grande counties will now have access to this life saving drone.",,0,0,0,0,,0,115,597,1,0,0,5/16/17,,1,{},0,0,0,,,,0,0,,
1,0,,0,,0,1,1,111,MCCONNELL,,,10,0,0.027,b58fe77f58212492b54b5df802db6808,0.404,Mitch,0,,14921,INTELLIGENCE COMMITTEE REORGANIZATION,1,1,,KENTUCK,3,,"We in Congress passed the PATRIOT Act, which reformed the FBI and provided our law enforcement agencies with greater tools to combat terrorism. We fast-tracked the procurement of specialized equipment such as the Predator unmanned aerial vehicle for our military forces in Afghanistan.",,0,0,0,0,1,0,108,1550,1,0,1,10/6/04,51,1,"{u'FOREIGNPOLICY': 1, u'DOMESTIC-LEGALITY': 1}",0,0,0,-0.22295254863254407,,,,0,509,0.22295254863254407
1,0,,0,,,,0,17,,,,,0,,ebb83c9f092fcc1f34addff4b2671e1d,,,0,,,NATIONAL DEFENSE AUTHORIZATION ACT FOR FISCAL YEAR 2006,,0,,,,,"Further, the Office of the Secretary of Defense is there for a purpose, to exercise oversight and reconcile differing service requirements. OSD needs to start exercising its responsibility in programs like unmanned aerial vehicles and helicopter development.",0,,0,0,0,,0,109,,0,0,0,5/25/05,,,{u'FINANCE': 0},0,0,1,,,,,0,,
0,0,,1,,0,1,0,26,PAUL,,,2,0,-0.5,5a826146a324c73674c5f0881141ffc9,0.866,Rand,0,-1,41104,UNANIMOUS CONSENT REQUEST--EXECUTIVE CALENDAR,,,,KENTUCK,2,,"If we could get the administration or the Attorney General to put their answer in a succinct form and simply say they believe they have the authority to repel an attack, which most of--I think all of us agree to that, but they do not have the authority to kill someone in a restaurant, to kill someone at home in their house, to kill someone when they are eating dinner; that, really, if you want to say that you can use drones in America to strike people, not only would it have to be remarkably different, it could not be anything like the way we use drones around the world, which brings up some other important questions.",,0,0,1,0,,0,113,1399,0,0,0,3/6/13,51,1,{},0,0,0,2.6571794444104921,,,1,0,537,2.6571794444104921
1,0,,0,,0,1,0,312,DAYTON,-1,,2,0,0.209,6690cce8de5b192158362e2e8f678a21,-0.421,Mark,0,,40101,TELLING US THE TRUTH,,,,MINNESO,2,,"Ten days later, just before Congress voted on his desire for a resolution, the President added that ``Iraq is exploring ways of using UVAs--unmanned aerial vehicles--for missions targeting the United States''.",,1,1,0,0,,0,108,1210,0,0,0,9/11/03,33,1,{u'REFERENCE': -1},0,0,0,0.60966968049561909,,,,0,508,0.60966968049561909
1,0,,0,,,,0,464,,,-1,,0,,5604121ca7e141d7a8df3b550902f34e,,,0,,,"SAFE, ACCOUNTABLE, FLEXIBLE, AND EFFICIENT TRANSPORTATION EQUITY ACT OF 
  2003",,,,,,,"What we want to do is get at the truth. We were told there were weapons of mass destruction and we were told there were unmanned aerial vehicles, pilotless drones, and we were told there was even a potential plan to put those drones on ships off the Atlantic coast to drop those chemical and biological weapons over eastern seaboard American cities, and all of that turned out not to be true.",,,0,0,0,,0,108,,0,0,0,2/10/04,,,{u'FOREIGNUSE': -1},1,0,0,,,,,0,,
1,0,,,,,1,1,1,Royce,,,,0,,5876dad4ecec5baed41114256243f43c,,Edward,0,,,"CONDEMNING NORTH KOREA'S DEVELOPMENT OF MULTIPLE INTERCONTINENTAL 
  BALLISTIC MISSILES",1,1,,CALIFORNIA,,,"The administration has also demonstrated peace through strength by backing up their commitments to our allies with action. We have begun deploying the THAAD missile defense system, recently resumed the annual military training exercises with South Korea, and deployed attack drones to support our servicemembers stationed in the region. This defends the extraordinary people of South Korea, who have developed one of the most prosperous nations on Earth.",,0,0,0,0,,0,115,640,1,0,0,4/3/17,,2,{u'FOREIGNPOLICY': 1},0,0,0,,,,,1,,
1,0,,0,,,,0,2,,0,,,0,,b1ec2237e346d90fa97de3161388c362,,,0,,,"CONGRESSIONAL REPLACEMENT OF PRESIDENT OBAMA'S ENERGY-RESTRICTING AND 
  JOB-LIMITING OFFSHORE DRILLING PLAN",,0,,,,,"Prior to the enactment of the current moratorium, then Secretary of Defense Donald Rumsfeld stated that ``in those areas east of the Military Mission Line, drilling structures and associated development would be incompatible with military activities, such as missile flights, low-flying drone aircraft, weapons testing and training.'' By maintaining the drilling ban in the Eastern Gulf of Mexico, H.R. 6082 continues to protect an area that holds the U.S. military's largest training and testing area.",,,1,0,0,,0,112,,0,0,0,7/25/12,,,{u'REFERENCE': 0},0,0,0,,,,,1,,
1,0,,0,,1,1,0,21,DEAL,0,,7,0,0.139,45567aa791e919afa32386b32093923e,0.581,Nathan,0,,99342,"JOHN BURL HULSEY, SR.",,0,,GEORGIA,5,,"In addition to being stationed for training at naval air stations in Chamblee, Georgia, Pensacola, Florida, and New Orleans, he and other members of what were called STAG I spent several years in Clinton, Oklahoma and Traverse City, Michigan, where they conducted extensive testing and development of the drone project prior to deployment to the Pacific theater.",,0,1,0,0,,0,110,213,1,0,0,6/4/08,44,2,{u'REFERENCE': 0},0,0,0,0.88047464350732019,,,,0,1336,0.88047464350732019
1,0,,0,,0,1,0,,BIDEN,,-1,15,0,-0.042,b5778d61aa3debfa9b5a60d6a0366467,-0.314,Joseph,0,,14101,AUTHORIZATION OF THE USE OF UNITED STATES ARMED FORCES AGAINST IRAQ,,,,DELAWAR,2,,"For two decades, Saddam Hussein has relentlessly pursued weapons of mass destruction. There is a broad agreement that he retains chemical and biological weapons, the means to manufacture those weapons and modified Scud missiles, and that he is actively seeking a nuclear capability. It remains less clear how effective his delivery vehicles are, whether they be the al-Hussein missiles, with a 650 kilometer range, short-range missiles, or untested and unmanned aerial vehicles for the dispersion of chemical and biological weapons.",,1,0,0,0,,0,107,85,0,0,0,10/10/02,11,0,{u'FOREIGNUSE': -1},1,0,0,-0.15941819299861598,,,,1,449,0.15941819299861598
0,0,,1,,0,1,0,26,PAUL,,,2,0,-0.5,40421168b43a72234112999cc6289252,0.866,Rand,0,-1,41104,UNANIMOUS CONSENT REQUEST--EXECUTIVE CALENDAR,,,,KENTUCK,2,,"Our concern is that the Attorney General's response has been a little more vague. Basically they have not done any killings in the United States yet. They don't have any intention to, but they might. The problem with the ``they might'' part is they left it kind of vague. They said it would have to be extraordinary, but they point out two occurrences in which they would not have targeted drone strikes. They point out Pearl Harbor and 9/11.",,0,0,1,0,,0,113,1399,0,0,0,3/6/13,51,1,{},0,0,0,2.6571794444104921,,,1,0,537,2.6571794444104921
0,0,,1,,0,1,0,26,CRUZ,,,1,0,-0.196,ed97d3a006d24881a17bf0f5a7afc072,0.858,Ted,0,-1,41304,BRENNAN NOMINATION,,,,TEXAS,1,,"Is the Senator from Kentucky aware of any precedent whatsoever for what I consider to be the remarkable proposition that the U.S. Government, without indicting him, without bringing him before a jury, without any due process whatsoever could simply send a drone to kill that U.S. citizen on U.S. soil?",,0,0,0,0,,0,113,2129,0,0,0,3/6/13,49,2,{},0,0,0,2.6073070289465434,,,1,0,510,2.6073070289465434
0,0,,1,,0,0,0,27,LANDRIEU,,,8,0,0.444,7c3e589bd0e596c1ecde6b6ade32379d,-0.203,Mary,0,1,49702,TRIBUTE TO MAJOR GENERAL BENNY LANDRENEAU,,,,LOUISIA,7,,"General Franks needed an unmanned aerial vehicle landing strip built immediately, so he knew who to call to get that job done. He called Benny Landreneau and his battalion. Need I say that it was done, I am sure, under budget and before time.",,1,0,0,0,,0,112,1116,1,0,0,12/14/11,45,1,{},0,0,0,-0.95725701503469163,,,0,0,400,0.95725701503469163
0,0,,1,,0,1,0,26,PAUL,,,2,0,-0.5,16eaa62aaeeadd1e45cae46e118b82de,0.866,Rand,0,-1,41104,UNANIMOUS CONSENT REQUEST--EXECUTIVE CALENDAR,,,,KENTUCK,2,,"My suspicion is they will rule in favor of warrants on drones too. Although there is some dispute over what they call open spaces. I think that with open spaces we need to be concerned that just because you are not inside your house does not mean you don't still deserve some privacy on your own land. So it is not so much that the drone is necessarily our enemy, but it just allows the government to do so much more. We need to be very careful about the safeguards of the Constitution and requiring whether these safeguards are met as far as protecting our liberty.",,0,0,1,0,,0,113,1399,0,0,0,3/6/13,51,1,{},0,0,0,2.6571794444104921,,,1,0,537,2.6571794444104921
1,0,,0,,0,1,0,,SHELBY,,-1,4,0,0.591,112b3986058018ea1b4984968e1c6310,0.437,Richard,0,,94659,AUTHORIZATION OF THE USE OF UNITED STATES ARMED FORCES AGAINST IRAQ,,,,ALABAMA,2,,The threat is immediate and growing because Saddam has developed the ability to deliver his poisons and pestilence by unmanned aerial vehicles that can easily be smuggled into the United States.,,0,0,0,0,,0,107,816,1,0,0,10/10/02,41,1,{u'FOREIGNUSE': -1},1,0,0,-0.017228834843755911,,,,1,447,0.017228834843755911
1,0,,0,,0,1,0,291,INHOFE,0,,10,0,0.039,0e570a808f8f1f59402bbab1289233c4,0.552,James,0,,15424,CHINA'S SPREADING GLOBAL INFLUENCE,,,,OKLAHOM,4,,"The weapons in which China is investing include cruise missiles, submarines, long-range target acquisition systems, specifically cutting edge satellites, unmanned aerial vehicles, and the advanced SU-30 fighter aircraft, and I have to pause at this moment and say something about someone to this day I still think is a real American hero, GEN John Jumper, the Chief of the Air Force. Back before he was in that position in the late 1990s--I believe it was 1998--he had the courage to stand up and publicly say something, and it certainly was not endorsed or wanted by the Clinton administration, but he said we have to do something. We have stopped our modernization program so now Russia is selling tactical vehicles, air vehicles, that are better than our fighters. He is talking about the SU-30 series, better than our F-15s and F-16s.",,0,1,0,0,,0,109,1370,1,0,0,4/4/05,53,0,{u'REFERENCE': 0},0,0,0,0.6996871374505067,,,,0,513,0.6996871374505067
0,0,,1,,0,1,0,27,VITTER,,,8,0,0.323,871aace7f54968436f3a8e29202a2609,0.495,David,0,-1,29918,EXECUTIVE SESSION,,,,LOUISIA,8,,"I strongly support Senator Paul's filibuster, oppose the use of drones in this country, and oppose both cloture and the confirmation of John Brennan.",,0,0,0,0,,0,113,1398,0,0,0,3/7/13,45,1,{},0,0,0,0.34434617726987204,,,1,0,506,0.34434617726987204
0,0,,1,,0,1,0,26,CRUZ,,,1,0,-0.196,b7e77b71fb32fbd089c6acec8cebbb5e,0.858,Ted,0,-1,41304,UNANIMOUS CONSENT REQUEST--EXECUTIVE CALENDAR,,,,TEXAS,1,,Rand Paul goes into his 9th hour of filibuster over drones. Watch it here.,,0,0,0,0,,0,113,2129,0,0,0,3/6/13,49,2,{},0,0,0,2.6073070289465434,,,1,0,510,2.6073070289465434
0,0,,1,,0,1,0,26,PAUL,,,2,0,-0.5,4a2ef5b394e02b9cdc0421a2d114d07f,0.866,Rand,0,-1,41104,BRENNAN NOMINATION,,,,KENTUCK,2,,"``No, no!'' said the Queen. ``Sentence first--verdict afterwards.'' ``Stuff and nonsense!'' Alice said loudly. ``The idea of having the sentence first.'' ``Hold your tongue!'' said the Queen, turning purple. ``I won't!'' said Alice. [``Release the drones,''] said the Queen, as she shouted at the top of her voice.",,0,0,1,0,,0,113,1399,0,0,0,3/6/13,51,1,{},0,0,0,2.6571794444104921,,,1,0,537,2.6571794444104921
1,0,,0,,1,1,0,21,DEAL,0,,7,0,0.139,6df207dc675b575d4d839f4a22153f78,0.581,Nathan,0,,99342,"JOHN BURL HULSEY, SR.",,0,,GEORGIA,5,,"Of the 47 total attacks carried out by STAG I during their brief mission in the Pacific, an unprecedented 22 targets resulted in direct hits, including island caves loaded with enemy ammunition and anti-aircraft installations in the Shortland Islands, Bougainville, and Rabaul. These attacks sustained a record 47 percent hit on intended targets, an incredible accomplishment in 1940's technology. The short mission ended as the war came to a close and U.S. forces began to extinguish their supplies of drones.",,0,1,0,0,,0,110,213,1,0,0,6/4/08,44,2,{u'REFERENCE': 0},0,0,0,0.88047464350732019,,,,0,1336,0.88047464350732019
1,0,,0,,1,1,0,,SNYDER,,-1,3,0,0.055,f628063e04e267dd90be20812c1e59b6,-0.268,Victor,0,0,29703,"FURTHER CONSIDERATION OF H. RES. 114, AUTHORIZATION FOR USE OF MILITARY 
  FORCE AGAINST IRAQ RESOLUTION OF 2002",,,,ARKANSA,2,,Saddam Hussein's intent is more difficult to discern. I believe the evidence of his ultimate intent to use these weapons or cause them to be used against the American people is strong enough that we cannot afford to ignore it. Iraq is developing missiles that can hit neighboring states and is building unmanned aerial vehicles to spread chemical and biological agents. I am concerned that Iraq is exploring ways to use these aerial vehicles for missions targeting the United States.,,1,0,0,0,,0,107,87,0,0,0,10/8/02,42,1,{u'FOREIGNUSE': -1},1,0,0,-0.49005410122978238,,,,1,658,0.49005410122978238
1,0,,0,,0,0,0,,COLLINS,,-1,3,0,-0.597,cb253f2b8ff6ddfb8f9a1323d995681d,0.106,Susan,0,,49703,AUTHORIZATION OF THE USE OF UNITED STATES ARMED FORCES AGAINST IRAQ,,,,MAINE,2,,"Even more troubling is the evidence compiled by the American and British intelligence agencies that Iraq has converted its L-29 jet trainers to allow them to be used as unmanned aerial vehicles, capable of delivering chemical and biological agents over a large area.",,0,0,0,0,,0,107,85,1,0,0,10/10/02,2,0,{u'FOREIGNUSE': -1},1,0,0,-2.0807000246646328,,,,1,457,2.0807000246646328
1,0,,0,,0,1,0,5,MCCAIN,-1,,16,0,-0.621,3ad9fb31b65a27b4d40263734c874b23,0.382,John,0,,15039,TERRORIST THREATS,,,,ARIZONA,8,,"An article from the New York Times, ``Iran Secretly Sending Drones and Supplies into Iraq, U.S. Officials Say,'' states:",,0,1,0,0,,0,113,922,0,0,0,6/26/14,61,2,{u'REFERENCE': -1},0,0,0,-0.36010169115840307,,,,1,525,0.36010169115840307
1,0,,0,,,1,0,0,Neugebauer,,,,0,,77ea4d1c7284d2a27d5816c4fdd4b1b0,,Randy,0,,,EARMARK DECLARATION,,1,,TEXAS,,,"This funding will focus on developing compact electromagnetic generators for integration into standard weapons systems for defense applications that require the destruction of electronic hardware while minimizing collateral damage. Examples of applications include placement on HUMVEES, in cruise missiles and attached to unmanned aerial vehicles (UAVs). A key target of this technology is the disruption of remote detonation electronics used in improvised roadside bombs and inner-city car-bombs.",,0,0,0,0,,0,111,559,0,0,0,6/23/09,,2,{u'TECHNOLOGY': 1},0,1,0,,1,,,1,,
0,0,,1,,0,1,0,26,PAUL,,,2,0,-0.5,bb9546771b2ef431361bc12c22f3a130,0.866,Rand,0,-1,41104,UNANIMOUS CONSENT REQUEST--EXECUTIVE CALENDAR,,,,KENTUCK,2,,"In both of those instances, I think it is appropriate to respond militarily, but they would not have targeted drone strikes. They might use drones, but they would not have targeted drone strikes because they would be responding immediately to someone attacking us. I think we all agree that we can respond to lethal force at any point in time.",,0,0,1,0,,0,113,1399,0,0,0,3/6/13,51,1,{},0,0,0,2.6571794444104921,,,1,0,537,2.6571794444104921
